{
  "chain": "ethereum",
  "chainId": 1,
  "treasuryAddress": "0x2Bc456799F3Cf071B10CE7216269471e0A40381a",
  "generatedAt": "2026-10-21T20:10:47.896Z",
  "native": {
    "symbol": "ETH",
    "decimals": 18,
    "balanceWei": "765000000000000000",
    "balanceFormatted": "0.765",
    "explorerAddressUrl": "https://etherscan.io/address/0x2Bc456799F3Cf071B10CE7216269471e0A40381a"
  },
  "tokens": {
    "USDT": {
      "symbol": "USDT",
      "contract": "0xdAC17F958D2ee523a2206206994597C13D831ec7",
      "decimals": 6,
      "balanceRaw": "42890504292",
      "balanceFormatted": "42890.504292",
      "explorerTokenUrl": "https://etherscan.io/token/0xdAC17F958D2ee523a2206206994597C13D831ec7"
    }
  },
  "recentTransfers": {
    "USDT": [
      {
        "hash": "0x50d1c9e8e2bc6dfbb973e5594edbe28be947bffcfc39fc1565a892f4a6fa0e59",
        "timestamp": "2026-06-25T16:50:35.000Z",
        "from": "0x813f7275c322b76de4d827316c54599aff48973e",
        "to": "0x2bc456799f3cf071b10ce7216269471e0a40381a",
        "direction": "in",
        "amountRaw": "500",
        "amountFormatted": "0.0005",
        "explorerTxUrl": "https://etherscan.io/tx/0x50d1c9e8e2bc6dfbb973e5594edbe28be947bffcfc39fc1565a892f4a6fa0e59"
      },
      {
        "hash": "0xbd67132972cdece0f8e7770bafc6f1546b8bacaebec789dc5b7528ce90f65109",
        "timestamp": "2026-06-18T02:27:23.000Z",
        "from": "0x2bc456799f3cf071b10ce7216269471e0a40381a",
        "to": "0x813f227336f99aabbec1ea47a77fffbe8066973e",
        "direction": "out",
        "amountRaw": "0",
        "amountFormatted": "0.0",
        "explorerTxUrl": "https://etherscan.io/tx/0xbd67132972cdece0f8e7770bafc6f1546b8bacaebec789dc5b7528ce90f65109"
      },
      {
        "hash": "0x61c8110fef9aa37fd855ed34ccbe1de7e4ff5444231e3c7dd5822fce0eed227e",
        "timestamp": "2026-06-17T17:41:23.000Z",
        "from": "0x813f7275c322b76de4d827316c54599aff48973e",
        "to": "0x2bc456799f3cf071b10ce7216269471e0a40381a",
        "direction": "in",
        "amountRaw": "495",
        "amountFormatted": "0.000495",
        "explorerTxUrl": "https://etherscan.io/tx/0x61c8110fef9aa37fd855ed34ccbe1de7e4ff5444231e3c7dd5822fce0eed227e"
      },
      {
        "hash": "0x5a91403c787b184cc61627550ea23504b34c817eece3fd3f43c9a0e55365c953",
        "timestamp": "2026-06-17T17:40:47.000Z",
        "from": "0x2bc456799f3cf071b10ce7216269471e0a40381a",
        "to": "0x813f5edd317ed74e6397f37cb6c42c4950cc973e",
        "direction": "out",
        "amountRaw": "4950000000",
        "amountFormatted": "4950.0",
        "explorerTxUrl": "https://etherscan.io/tx/0x5a91403c787b184cc61627550ea23504b34c817eece3fd3f43c9a0e55365c953"
      },
      {
        "hash": "0x0cd61c32c9521cca0ded8eb92a3f5cf1c619a490a8cc9b0fb855f8ff360449fe",
        "timestamp": "2026-06-17T17:36:59.000Z",
        "from": "0x813f7275c322b76de4d827316c54599aff48973e",
        "to": "0x2bc456799f3cf071b10ce7216269471e0a40381a",
        "direction": "in",
        "amountRaw": "500",
        "amountFormatted": "0.0005",
        "explorerTxUrl": "https://etherscan.io/tx/0x0cd61c32c9521cca0ded8eb92a3f5cf1c619a490a8cc9b0fb855f8ff360449fe"
      },
      {
        "hash": "0x69c6c7b060ba47ddebfafe5d7a57e66b30a487d010cc0607d04bd1092f3d35fe",
        "timestamp": "2026-06-17T17:36:11.000Z",
        "from": "0x2bc456799f3cf071b10ce7216269471e0a40381a",
        "to": "0x813f5edd317ed74e6397f37cb6c42c4950cc973e",
        "direction": "out",
        "amountRaw": "50000000",
        "amountFormatted": "50.0",
        "explorerTxUrl": "https://etherscan.io/tx/0x69c6c7b060ba47ddebfafe5d7a57e66b30a487d010cc0607d04bd1092f3d35fe"
      },
      {
        "hash": "0xb315bb8655d26c70571408a8515ee6b41f746bc3991b368699a39586dbb7bd4a",
        "timestamp": "2026-05-01T11:47:47.000Z",
        "from": "0xce5482acfea29cb04f2676521fb2d374f1f590bf",
        "to": "0x2bc456799f3cf071b10ce7216269471e0a40381a",
        "direction": "in",
        "amountRaw": "200",
        "amountFormatted": "0.0002",
        "explorerTxUrl": "https://etherscan.io/tx/0xb315bb8655d26c70571408a8515ee6b41f746bc3991b368699a39586dbb7bd4a"
      },
      {
        "hash": "0x4881267f1026fce472727ca1bf321e9ab684b94f1f1baf9eeed4dadf5145381f",
        "timestamp": "2026-05-01T11:47:23.000Z",
        "from": "0x2bc456799f3cf071b10ce7216269471e0a40381a",
        "to": "0xce54fbc5738153ae19d8daa31792ab3b4afd90bf",
        "direction": "out",
        "amountRaw": "2000000000",
        "amountFormatted": "2000.0",
        "explorerTxUrl": "https://etherscan.io/tx/0x4881267f1026fce472727ca1bf321e9ab684b94f1f1baf9eeed4dadf5145381f"
      },
      {
        "hash": "0x0abc2a6b7e359b1112dfec377ff4de26bbfc32aa57d74c76bdb868710c4b318a",
        "timestamp": "2026-04-05T10:39:47.000Z",
        "from": "0x2bc456799f3cf071b10ce7216269471e0a40381a",
        "to": "0x813f227336f99aabbec1ea47a77fffbe8066973e",
        "direction": "out",
        "amountRaw": "0",
        "amountFormatted": "0.0",
        "explorerTxUrl": "https://etherscan.io/tx/0x0abc2a6b7e359b1112dfec377ff4de26bbfc32aa57d74c76bdb868710c4b318a"
      },
      {
        "hash": "0x29ce919e04286558c230d5babe29782114078bebe1524b616591cbd04d55d638",
        "timestamp": "2026-04-05T09:48:35.000Z",
        "from": "0x813f7275c322b76de4d827316c54599aff48973e",
        "to": "0x2bc456799f3cf071b10ce7216269471e0a40381a",
        "direction": "in",
        "amountRaw": "290",
        "amountFormatted": "0.00029",
        "explorerTxUrl": "https://etherscan.io/tx/0x29ce919e04286558c230d5babe29782114078bebe1524b616591cbd04d55d638"
      },
      {
        "hash": "0x190459a818229308b29fefe8a8c9380574909a64cb8c1d9f5dee659bd6e07d9d",
        "timestamp": "2026-04-05T09:47:35.000Z",
        "from": "0x81321c86e521eb9f8b29f924fe01bd25b3fd973e",
        "to": "0x2bc456799f3cf071b10ce7216269471e0a40381a",
        "direction": "in",
        "amountRaw": "290",
        "amountFormatted": "0.00029",
        "explorerTxUrl": "https://etherscan.io/tx/0x190459a818229308b29fefe8a8c9380574909a64cb8c1d9f5dee659bd6e07d9d"
      },
      {
        "hash": "0xcdadb96f12f9b605e44333907c593652e32bfd1318ed728d1b0682d90ce7f8f4",
        "timestamp": "2026-04-05T09:41:23.000Z",
        "from": "0x2bc456799f3cf071b10ce7216269471e0a40381a",
        "to": "0x813f5edd317ed74e6397f37cb6c42c4950cc973e",
        "direction": "out",
        "amountRaw": "2900000000",
        "amountFormatted": "2900.0",
        "explorerTxUrl": "https://etherscan.io/tx/0xcdadb96f12f9b605e44333907c593652e32bfd1318ed728d1b0682d90ce7f8f4"
      },
      {
        "hash": "0x3dcf52a5fb852af27148e935e6739a0e725dee71e9bb16c2510fb6d7a2bb10c5",
        "timestamp": "2026-04-05T09:40:23.000Z",
        "from": "0x813f7275c322b76de4d827316c54599aff48973e",
        "to": "0x2bc456799f3cf071b10ce7216269471e0a40381a",
        "direction": "in",
        "amountRaw": "100",
        "amountFormatted": "0.0001",
        "explorerTxUrl": "https://etherscan.io/tx/0x3dcf52a5fb852af27148e935e6739a0e725dee71e9bb16c2510fb6d7a2bb10c5"
      },
      {
        "hash": "0x56db9e785da60e8477dc4a0fd8a1a7845a158b3d6022c0228c619a31a091ae21",
        "timestamp": "2026-04-05T09:35:47.000Z",
        "from": "0x2bc456799f3cf071b10ce7216269471e0a40381a",
        "to": "0x813f5edd317ed74e6397f37cb6c42c4950cc973e",
        "direction": "out",
        "amountRaw": "100000000",
        "amountFormatted": "100.0",
        "explorerTxUrl": "https://etherscan.io/tx/0x56db9e785da60e8477dc4a0fd8a1a7845a158b3d6022c0228c619a31a091ae21"
      },
      {
        "hash": "0xa77742befe9bec082462bf1e49f3df2b96bcb37373355094266fc76c8a37ca67",
        "timestamp": "2026-01-06T18:08:35.000Z",
        "from": "0xc4e597f76e60a0e6a2aa4368306ce98a47a6812e",
        "to": "0x2bc456799f3cf071b10ce7216269471e0a40381a",
        "direction": "in",
        "amountRaw": "51890501917",
        "amountFormatted": "51890.501917",
        "explorerTxUrl": "https://etherscan.io/tx/0xa77742befe9bec082462bf1e49f3df2b96bcb37373355094266fc76c8a37ca67"
      },
      {
        "hash": "0x9dadebfc2e9cf24ee5c6497e5c46513d60ab4cbca497f50f26bf57ac220010d1",
        "timestamp": "2026-01-06T18:06:59.000Z",
        "from": "0xc4e597f76e60a0e6a2aa4368306ce98a47a6812e",
        "to": "0x2bc456799f3cf071b10ce7216269471e0a40381a",
        "direction": "in",
        "amountRaw": "1000000000",
        "amountFormatted": "1000.0",
        "explorerTxUrl": "https://etherscan.io/tx/0x9dadebfc2e9cf24ee5c6497e5c46513d60ab4cbca497f50f26bf57ac220010d1"
      }
    ]
  },
  "sources": {
    "rpc": "ETH_RPC_URL",
    "explorer": "https://etherscan.io"
  }
}
